{
  "$schema": "https://json-schema.org/draft/2020-12/schema",
  "$id": "https://cyber-risk.local/schemas/scenario.schema.json",
  "title": "Threat Scenario",
  "type": "object",
  "required": [
    "scenario_id",
    "title",
    "scenario_family",
    "actor_type",
    "attack_vector",
    "target_asset",
    "target_process",
    "loss_event",
    "business_consequence"
  ],
  "properties": {
    "scenario_id": {
      "type": "string"
    },
    "title": {
      "type": "string"
    },
    "scenario_family": {
      "type": "string",
      "enum": [
        "Ransomware",
        "BEC",
        "DataBreach",
        "CredentialStuffing",
        "CloudExposure",
        "ThirdPartyCompromise",
        "InsiderExfiltration",
        "PrivilegedTakeover",
        "WebAppExploit",
        "DestructiveMalware"
      ]
    },
    "actor_type": {
      "type": "string",
      "enum": [
        "Ransomware",
        "BEC",
        "Opportunistic",
        "Insider",
        "Hacktivist",
        "StateAligned"
      ]
    },
    "attack_vector": {
      "type": "string"
    },
    "mitre_attack_techniques": {
      "type": "array",
      "items": {
        "type": "string"
      }
    },
    "target_asset": {
      "type": "string"
    },
    "target_process": {
      "type": "string"
    },
    "data_involved": {
      "type": "array",
      "items": {
        "type": "string"
      }
    },
    "preconditions": {
      "type": "array",
      "items": {
        "type": "string"
      }
    },
    "loss_event": {
      "type": "string"
    },
    "business_consequence": {
      "type": "string"
    },
    "recommended_controls": {
      "type": "array",
      "items": {
        "type": "string"
      }
    },
    "confidence": {
      "type": "number",
      "minimum": 0,
      "maximum": 1
    }
  },
  "additionalProperties": false
}
